{
  "id": "REL-20260516-001",
  "version": "3.0.0",
  "timestamp": "2026-05-16T18:00:00Z",
  "status": "APPROVED",
  "approval": {
    "approvedBy": "QA Agent",
    "timestamp": "2026-05-16T17:55:00Z",
    "notes": "All V3 hardening gates passed."
  },
  "commitSHA": "7de1fd393077c28938d6690a3cef3255f7c8f441",
  "deploymentScope": "full"
}
